id,eissn,title_display,article_type,author_display,journal,publication_date,score,abstract,keyword,bibjson.link,title,provider,publisher,subject,active,article_statistics.statistics,author_copyright.copyright,author_publishing_rights.publishing_rights,editorial_review.process,format,language,plagiarism_detection.detection
10.1371/journal.pone.0192191,1932-6203,The prevalence and trends of waterpipe tobacco smoking: A systematic review,Research Article,"['Mohammed Jawad', 'Rana Charide', 'Reem Waziry', 'Andrea Darzi', 'Rami A. Ballout', 'Elie A. Akl']",PLoS ONE,2018-02-09T00:00:00Z,7.741093,"['Introduction: Waterpipe tobacco smoking is harmful to health however its prevalence estimates remain uncertain. We aimed to systematically review the medical literature on waterpipe tobacco prevalence and trends. Methods: We searched Medline, Embase and ISI Web of Science for ‘waterpipe’ and its synonyms, without using language or date restrictions. We included any measure of waterpipe tobacco smoking prevalence in jurisdictionally representative populations. We stratified findings by prevalence measure (past 30 day, ever, regular or occasional, daily, other or unspecified) and age (adults or youth). Results: We included 129 studies reporting 355 estimates for 68 countries. In general, prevalence estimates among adults were highest in the Eastern Mediterranean, and among youth were about equal between Eastern Mediterranean and European regions. Past 30 day use was highest among Lebanese youth (37.2% in 2008), ever use was highest among Lebanese youth in 2002 and Lebanese university students in 2005 (both 65.3%), regular or occasional use was highest in among Iranian university students (16.3% in 2005), and daily use was highest among Egyptian youth (10.4% in 2005). Trend data were limited but most studies reported increased use over time, ranging from 0.3–1.0% per year among youth in the US to 2.9% per year among youth in Jordan (both for past 30 day use). Results were similar for ever use trends. Turkey (2.3% in 2008 to 0.8% in 2010) and Iraq (6.3% in 2008 and 4.8% in 2012) both witnessed decreased waterpipe use. Conclusion: Waterpipe tobacco smoking is most prevalent in Eastern Mediterranean and European countries, and appears higher among youth than adults. Continued surveillance will be important to assess and inform policy measures to control waterpipe tobacco use. ']",tobacco,http://europepmc.org/articles/PMC5806869?pdf=render,PLoS ONE,Public Library of Science (PLoS),Public Library of Science (PLoS),Medicine,True,True,True,True,Peer review,"['PDF', 'HTML', 'XML']",['EN'],True
10.1371/journal.pone.0107778,1932-6203,"Multiple Different Defense Mechanisms Are Activated in the Young Transgenic Tobacco Plants Which Express the Full Length Genome of the Tobacco Mosaic Virus, and Are Resistant against this Virus",Research Article,"['Balaji Jada', 'Arto J. Soitamo', 'Shahid Aslam Siddiqui', 'Gayatri Murukesan', 'Eva-Mari Aro', 'Tapio Salakoski', 'Kirsi Lehto']",PLoS ONE,2014-09-22T00:00:00Z,7.3069916,"['\nPreviously described transgenic tobacco lines express the full length infectious Tobacco mosaic virus (TMV) genome under the 35S promoter (Siddiqui et al., 2007. Mol Plant Microbe Interact, 20: 1489–1494). Through their young stages these plants exhibit strong resistance against both the endogenously expressed and exogenously inoculated TMV, but at the age of about 7–8 weeks they break into TMV infection, with typical severe virus symptoms. Infections with some other viruses (Potato viruses Y, A, and X) induce the breaking of the TMV resistance and lead to synergistic proliferation of both viruses. To deduce the gene functions related to this early resistance, we have performed microarray analysis of the transgenic plants during the early resistant stage, and after the resistance break, and also of TMV-infected wild type tobacco plants. Comparison of these transcriptomes to those of corresponding wild type healthy plants indicated that 1362, 1150 and 550 transcripts were up-regulated in the transgenic plants before and after the resistance break, and in the TMV-infected wild type tobacco plants, respectively, and 1422, 1200 and 480 transcripts were down-regulated in these plants, respectively. These transcriptome alterations were distinctly different between the three types of plants, and it appears that several different mechanisms, such as the enhanced expression of the defense, hormone signaling and protein degradation pathways contributed to the TMV-resistance in the young transgenic plants. In addition to these alterations, we also observed a distinct and unique gene expression alteration in these plants, which was the strong suppression of the translational machinery. This may also contribute to the resistance by slowing down the synthesis of viral proteins. Viral replication potential may also be suppressed, to some extent, by the reduction of the translation initiation and elongation factors eIF-3 and eEF1A and B, which are required for the TMV replication complex.\n']",tobacco,http://europepmc.org/articles/PMC4171492?pdf=render,PLoS ONE,Public Library of Science (PLoS),Public Library of Science (PLoS),Medicine,True,True,True,True,Peer review,"['PDF', 'HTML', 'XML']",['EN'],True
10.1371/journal.pone.0198942,1932-6203,Tobacco control policies to promote awareness and smoke-free environments in residence and workplace to reduce passive tobacco smoking in Bangladesh and its correlates,Research Article,"['Papia Sultana', 'Md. Tahidur Rahman', 'Dulal Chandra Roy', 'Shamima Akter', 'Jenny Jung', 'Md. Mizanur Rahman', 'Jahanara Akter']",PLoS ONE,2018-06-19T00:00:00Z,7.3069916,"['Background: Bangladesh is one of the highest tobacco consuming countries in the world, with reported 21.2% of the population as daily smokers, 24.3% as smokeless tobacco users, and 36.3% as adult passive smoker. Given the high prevalence and established harmful effects of passive tobacco smoking, this study aimed to estimate of pattern of smoking policies in residential and work place, and to identify the associated socio-economic and demographic correlates in Bangladesh. Data and methods: Secondary data of sample size 9629 collected by the Global Adult Tobacco Survey (GATS) 2010 has been used. Along with descriptive analysis, binary logistic regression model has been used to analyze the socio-demographic and economic correlates to tobacco smoking policy. Results: The prevalence of male and female passive tobacco smokers was 74.3% and 25.8% respectively. Among the passive tobacco smokers, 22.2% reported that smoking was allowed at their home and 29.8% reported that there was no such smoking policy at their home. Alternatively, 26.0% passive tobacco smokers reported that smoking was allowed and 27.5% reported that there was no such smoking policy at their work place. Logistic regression analysis indicated that for tobacco smokers group, the odds of allowing smoking at home was 4.85 times higher than the non-smoker respondent (OR = 4.85, 95% CI = 4.13, 5.71), 1.18 times more likely to be allowed at home in rural areas than urban areas (OR = 1.18, 95% CI = 1.06,1.32) and less for college/university completed and (or) higher educated respondent than no formal schooling (OR = 0.35, 95% CI = 0.24, 0.52). On the other hand, smoking was 1.70 times more likely to be allowed at work place for tobacco smokers than their counter part respondent (OR = 1.70, 95% CI = 1.36, 2.14) and was less likely to be allowed for college/university completed and (or) higher educated respondent (OR = 0.26, 95% CI = 0.14, 0.45) than respondent with no formal schooling. Conclusion: To reduce the passive smoking, lower educated people and people in urban areas should advocate more about the adverse effect of active and passive tobacco smoking. Also, smoking policy should reform introducing smoking zone at work places and residential buildings. ']",tobacco,http://europepmc.org/articles/PMC6007922?pdf=render,PLoS ONE,Public Library of Science (PLoS),Public Library of Science (PLoS),Medicine,True,True,True,True,Peer review,"['PDF', 'HTML', 'XML']",['EN'],True
10.1371/journal.pone.0113385,1932-6203,Systematic Review and Meta-Analysis of Association of Smokeless Tobacco and of Betel Quid without Tobacco with Incidence of Oral Cancer in South Asia and the Pacific,Research Article,"['Bhawna Gupta', 'Newell W. Johnson']",PLoS ONE,2014-11-20T00:00:00Z,7.3069916,"[""Aim: This systematic review and meta-analysis aimed to critically appraised data from comparable studies leading to quantitative assessment of any independent association between use of oral smokeless tobacco in any form, of betel quid without tobacco and of areca nut with incidence of oral cancer in South Asia and the Pacific. Methods: Studies (case control and/or cohort) were identified by searching Pub Med, CINAHL and Cochrane databases through June 2013 using the keywords oral cancer: chewing tobacco; smokeless tobacco; betel quid; betel quid without tobacco; areca nut; Asia, the Pacific and the reference lists of retrieved articles. A random effects model was used to compute adjusted summary ORRE for the main effect of these habits along with their corresponding 95% confidence intervals. To quantify the impact of between-study heterogeneity on adjusted main-effect summary ORRE, Higgins' H and I2 statistics along with their 95% uncertainty intervals were used. Funnel plots and Egger's test were used to evaluate publication bias. Results: Meta-analysis of fifteen case–control studies (4,553 cases; 8,632 controls) and four cohort studies (15,342) which met our inclusion criteria showed that chewing tobacco is significantly and independently associated with an increased risk of squamous-cell carcinoma of the oral cavity (adjusted main-effect summary for case- control studies ORRE\u200a=\u200a7.46; 95% CI\u200a=\u200a5.86–9.50, P<0.001), (adjusted main-effect summary for cohort studies RR\u200a=\u200a5.48; 95% CI\u200a=\u200a2.56–11.71, P<0.001). Furthermore, meta-analysis of fifteen case control studies (4,648 cases; 7,847 controls) has shown betel quid without tobacco to have an independent positive association with oral cancer, with OR\u200a=\u200a2.82 (95% CI\u200a=\u200a2.35–3.40, P<0.001). This is presumably due to the carcinogenicity of areca nut. There was no significant publication bias. Conclusion: There is convincing evidence that smokeless (aka chewing) tobacco, often used as a component of betel quid, and betel quid without tobacco, are both strong and independent risk factors for oral cancer in these populations. However, studies with better separation of the types of tobacco and the ways in which it is used, and studies with sufficient power to quantify dose-response relationships are still needed. ""]",tobacco,http://europepmc.org/articles/PMC4239077?pdf=render,PLoS ONE,Public Library of Science (PLoS),Public Library of Science (PLoS),Medicine,True,True,True,True,Peer review,"['PDF', 'HTML', 'XML']",['EN'],True
10.1371/journal.pone.0184425,1932-6203,DNA aneuploidy relationship with patient age and tobacco smoke in OPMDs/OSCCs,Research Article,"['Patrizio Castagnola', 'Sergio Gandolfo', 'Davide Malacarne', 'Cinzia Aiello', 'Roberto Marino', 'Gabriele Zoppoli', 'Alberto Ballestrero', 'Walter Giaretti', 'Monica Pentenero']",PLoS ONE,2017-09-06T00:00:00Z,6.8413234,"['\nThe aim of this study was to investigate the relationship between tobacco smoke habit, patient age, DNA aneuploidy and genomic DNA copy number aberrations (CNAs) in oral potentially malignant disorder (OPMD) and oral squamous cell carcinoma (OSCC) patients. DNA aneuploidy was detected by high-resolution DNA flow cytometry (hr DNA-FCM) on DAPI stained nuclei obtained from multiple tissue samples from OPMDs/OSCCs in 220 consecutive patients. Nuclear genomic aberrations were determined in a subset of 65 patients by genome-wide array comparative genomic hybridization (aCGH) using DNA extracted from either diploid or aneuploid nuclei suspension sorted by FCM. DNA aneuploidy and mean nuclear genomic aberrations were associated with patients’ age. In particular, DNA aneuploidy strongly associated with age in non-smoker OPMDs/OSCCs patients. OSCCs from smokers showed a lower prevalence of DNA aneuploidy compared to OSCCs from non-smokers. A higher occurrence of DNA aneuploidy (particularly in smokers’ OPMDs) was observed in patients characterized by involvement of a single oral subsite. Our study suggests that: 1) DNA aneuploidy in non-smokers is mainly related to aging; 2) OPMDs/OSCCs involving multiple oral subsites in smokers are less likely to develop DNA aneuploidy compared to non-smokers; 3) OSCC development is characterized by both CIN and CIN-independent mechanisms and that the latter are more relevant in smokers. This study provides evidence that DNA diploid OPMDs may be considered at lower risk of cancerization than DNA aneuploid ones in non-smokers but not in smokers.\n']",tobacco,http://europepmc.org/articles/PMC5587305?pdf=render,PLoS ONE,Public Library of Science (PLoS),Public Library of Science (PLoS),Medicine,True,True,True,True,Peer review,"['PDF', 'HTML', 'XML']",['EN'],True
10.1371/journal.pone.0102661,1932-6203,"The Only African Wild Tobacco, <i>Nicotiana africana</i>: Alkaloid Content and the Effect of Herbivory",Research Article,"['Danica Marlin', 'Susan W. Nicolson', 'Abdullahi A. Yusuf', 'Philip C. Stevenson', 'Heino M. Heyman', 'Kerstin Krüger']",PLoS ONE,2014-07-15T00:00:00Z,6.8413234,"['\nHerbivory in some Nicotiana species is known to induce alkaloid production. This study examined herbivore-induced defenses in the nornicotine-rich African tobacco N. africana, the only Nicotiana species indigenous to Africa. We tested the predictions that: 1) N. africana will have high constitutive levels of leaf, flower and nectar alkaloids; 2) leaf herbivory by the African bollworm Helicoverpa armigera will induce increased alkaloid levels in leaves, flowers and nectar; and 3) increased alkaloid concentrations in herbivore-damaged plants will negatively affect larval growth. We grew N. africana in large pots in a greenhouse and exposed flowering plants to densities of one, three and six fourth-instar larvae of H. armigera, for four days. Leaves, flowers and nectar were analyzed for nicotine, nornicotine and anabasine. The principal leaf alkaloid was nornicotine (mean: 28 µg/g dry mass) followed by anabasine (4.9 µg/g) and nicotine (0.6 µg/g). Nornicotine was found in low quantities in the flowers, but no nicotine or anabasine were recorded. The nectar contained none of the alkaloids measured. Larval growth was reduced when leaves of flowering plants were exposed to six larvae. As predicted by the optimal defense theory, herbivory had a localized effect and caused an increase in nornicotine concentrations in both undamaged top leaves of herbivore damaged plants and herbivore damaged leaves exposed to one and three larvae. The nicotine concentration increased in damaged compared to undamaged middle leaves. The nornicotine concentration was lower in damaged leaves of plants exposed to six compared to three larvae, suggesting that N. africana rather invests in new growth as opposed to protecting older leaves under severe attack. The results indicate that the nornicotine-rich N. africana will be unattractive to herbivores and more so when damaged, but that potential pollinators will be unaffected because the nectar remains alkaloid-free even after herbivory.\n']",tobacco,http://europepmc.org/articles/PMC4099186?pdf=render,PLoS ONE,Public Library of Science (PLoS),Public Library of Science (PLoS),Medicine,True,True,True,True,Peer review,"['PDF', 'HTML', 'XML']",['EN'],True
10.1371/journal.pone.0183410,1932-6203,snoRNA and piRNA expression levels modified by tobacco use in women with lung adenocarcinoma,Research Article,"['Natasha Andressa Nogueira Jorge', 'Gabriel Wajnberg', 'Carlos Gil Ferreira', 'Benilton de Sa Carvalho', 'Fabio Passetti']",PLoS ONE,2017-08-17T00:00:00Z,6.8413234,"['\nLung cancer is one of the most frequent types of cancer worldwide. Most patients are diagnosed at advanced stage and thus have poor prognosis. Smoking is a risk factor for lung cancer, however most smokers do not develop lung cancer while 20% of women with lung adenocarcinoma are non-smokers. Therefore, it is possible that these two groups present differences besides the smoking status, including differences in their gene expression signature. The altered expression patterns of non-coding RNAs in complex diseases make them potential biomarkers for diagnosis and treatment. We analyzed data from differentially and constitutively expressed PIWI-interacting RNAs and small nucleolar RNAs from publicly available small RNA high-throughput sequencing data in search of an expression pattern of non-coding RNA that could differentiate these two groups. Here, we report two sets of differentially expressed small non-coding RNAs identified in normal and tumoral tissues of women with lung adenocarcinoma, that discriminate between smokers and non-smokers. Our findings may offer new insights on metabolic alterations caused by tobacco and may be used for early diagnosis of lung cancer.\n']",tobacco,http://europepmc.org/articles/PMC5560661?pdf=render,PLoS ONE,Public Library of Science (PLoS),Public Library of Science (PLoS),Medicine,True,True,True,True,Peer review,"['PDF', 'HTML', 'XML']",['EN'],True
10.1371/journal.pone.0083826,1932-6203,Smokeless Tobacco Use: A Risk Factor for Hyperhomocysteinemia in a Pakistani Population,Research Article,"['Mohammad Perwaiz Iqbal', 'Mohsin Yakub']",PLoS ONE,2013-12-23T00:00:00Z,6.8413234,"['Background: Smokeless tobacco (ST) use is highly prevalent in the South Asian populations. While there have been a number of reports on association of ST consumption with cancer, very few studies have been conducted to investigate its relationship with cardiovascular disease. Hyperhomocysteinemia is a well-recognized risk factor for cardiovascular disease; however, its association with ST use has never been investigated. The objective of this study was to evaluate the relationship of ST use with hyperhomocysteinemia in an urban Pakistani population. Methodology/Principal Findings: In a cross-sectional study for assessment of risks of hyperhomocysteinemia, 872 healthy adults (355 males and 517 females of age range 18–60 years) were recruited from a low-income population in Karachi, Pakistan. A detailed questionnaire was administered which included information about smoking, non-smoking, use of ST alone (chewing as well as sniffing) and use of ST with betel nuts. Fasting serum/plasma levels of homocysteine, folate, vitamin B12 and pyridoxal phosphate (PLP; a coenzymic form of vitamin B6) were analyzed. In this population, 43.4% males and 15.5% females were found to be regular users of ST products. Laborers and vendors were the major ST consumers. Smoking was not found to be associated with plasma/serum concentrations of homocysteine, folate, vitamin B12 and PLP. However, homocysteine concentrations in the group which consumed ST alone and the group which consumed ST along with betel nut were significantly higher compared to the non-user group (17.7±7.5 µmol/L, 25.48 µmol/L vs. 11.95 µmol/L, respectively; p<0.01). Odds ratio for the association of hyperhomocysteinemia (>15 µmol/L) was 11-fold higher in the ST-consumer group compared to the non-user group, [OR (95%CI) \u200a=\u200a11.34 (7.58–16.96); p<0.001], when the model was adjusted for age, gender, folate and vitamin B12 status. Conclusion: This study shows a positive association between ST consumption and hyperhomocysteinemia in a low-income urban Pakistani population. ']",tobacco,http://europepmc.org/articles/PMC3871626?pdf=render,PLoS ONE,Public Library of Science (PLoS),Public Library of Science (PLoS),Medicine,True,True,True,True,Peer review,"['PDF', 'HTML', 'XML']",['EN'],True
10.1371/journal.pone.0138584,1932-6203,Feeding of Whitefly on Tobacco Decreases Aphid Performance via Increased Salicylate Signaling,Research Article,"['Haipeng Zhao', 'Xiaoying Zhang', 'Ming Xue', 'Xiao Zhang']",PLoS ONE,2015-09-18T00:00:00Z,6.8413234,"['Background: The feeding of Bemisia tabaci nymphs trigger the SA pathway in some plant species. A previous study showed that B. tabaci nymphs induced defense against aphids (Myzus persicae) in tobacco. However, the mechanism underlying this defense response is not well understood. Methodology/Principal Findings: Here, the effect of activating the SA signaling pathway in tobacco plants through B. tabaci nymph infestation on subsequent M. persicae colonization is investigated. Performance assays showed that B. tabaci nymphs pre-infestation significantly reduced M. persicae survival and fecundity systemically in wild-type (WT) but not salicylate-deficient (NahG) plants compared with respective control. However, pre-infestation had no obvious local effects on subsequent M. persicae in either WT or NahG tobacco. SA quantification results indicated that the highest accumulation of SA was induced by B. tabaci nymphs in WT plants after 15 days of infestation. These levels were 8.45- and 6.14-fold higher in the local and systemic leaves, respectively, than in controls. Meanwhile, no significant changes of SA levels were detected in NahG plants. Further, biochemical analysis of defense enzymes polyphenol oxidase (PPO), peroxidase (POD), β-1,3-glucanase, and chitinase demonstrated that B. tabaci nymph infestation increased these enzymes’ activity locally and systemically in WT plants, and there was more chitinase and β-1, 3-glucanase activity systemically than locally, which was opposite to the changing trends of PPO. However, B. tabaci nymph infestation caused no obvious increase in enzyme activity in any NahG plants except POD. Conclusions/Significance: In conclusion, these results underscore the important role that induction of the SA signaling pathway by B. tabaci nymphs plays in defeating aphids. It also indicates that the activity of β-1, 3-glucanase and chitinase may be positively correlated with resistance to aphids. ']",tobacco,http://europepmc.org/articles/PMC4575101?pdf=render,PLoS ONE,Public Library of Science (PLoS),Public Library of Science (PLoS),Medicine,True,True,True,True,Peer review,"['PDF', 'HTML', 'XML']",['EN'],True
10.1371/journal.pone.0059924,1932-6203,Ectopic Expression of Arabidopsis Glycosyltransferase <i>UGT85A5</i> Enhances Salt Stress Tolerance in Tobacco,Research Article,"['Yan-Guo Sun', 'Bo Wang', 'Shang-Hui Jin', 'Xiao-Xia Qu', 'Yan-Jie Li', 'Bing-Kai Hou']",PLoS ONE,2013-03-22T00:00:00Z,6.8413234,"['\n        Abiotic stresses greatly influence plant growth and productivity. While glycosyltransferases are widely distributed in plant kingdom, their biological roles in response to abiotic stresses are largely unknown. In this study, a novel Arabidopsis glycosyltransferase gene UGT85A5 was identified as significantly induced by salt stress. Ectopic expression of UGT85A5 in tobacco enhanced the salt stress tolerance in the transgenic plants. There were higher seed germination rates, better plant growth and less chlorophyll loss in transgenic lines compared to wild type plants under salt stress. This enhanced tolerance of salt stress was correlated with increased accumulations of proline and soluble sugars, but with decreases in malondialdehyde accumulation and Na+/K+ ratio in UGT85A5-expressing tobacco. Furthermore, during salt stress, expression of several carbohydrate metabolism-related genes including those for sucrose synthase, sucrose-phosphate synthase, hexose transporter and a group2 LEA protein were obviously upregulated in UGT85A5-expressing transgenic plants compared with wild type controls. Thus, these findings suggest a specific protective role of this glycosyltransferase against salt stress and provide a genetic engineering strategy to improve salt tolerance of crops.\n      ']",tobacco,http://europepmc.org/articles/PMC3606239?pdf=render,PLoS ONE,Public Library of Science (PLoS),Public Library of Science (PLoS),Medicine,True,True,True,True,Peer review,"['PDF', 'HTML', 'XML']",['EN'],True
