id,eissn,title_display,article_type,author_display,journal,publication_date,score,abstract,keyword,bibjson.link,title,provider,publisher,subject,active,article_statistics.statistics,author_copyright.copyright,author_publishing_rights.publishing_rights,editorial_review.process,format,language,plagiarism_detection.detection
10.1371/journal.pone.0102750,1932-6203,Metallothionein 2 (<i>SaMT2</i>) from <i>Sedum alfredii</i> Hance Confers Increased Cd Tolerance and Accumulation in Yeast and Tobacco,Research Article,"['Jie Zhang', 'Min Zhang', 'Shengke Tian', 'Lingli Lu', 'M. J. I. Shohag', 'Xiaoe Yang']",PLoS ONE,2014-07-17T00:00:00Z,5.635475,"['\nMetallothioneins are cysteine-rich metal-binding proteins. In the present study, SaMT2, a type 2 metallothionein gene, was isolated from Cd/Zn co-hyperaccumulator Sedum alfredii Hance. SaMT2 encodes a putative peptide of 79 amino acid residues including two cysteine-rich domains. The transcript level of SaMT2 was higher in shoots than in roots of S. alfredii, and was significantly induced by Cd and Zn treatments. Yeast expression assay showed SaMT2 significantly enhanced Cd tolerance and accumulation in yeast. Ectopic expression of SaMT2 in tobacco enhanced Cd and Zn tolerance and accumulation in both shoots and roots of the transgenic plants. The transgenic plants had higher antioxidant enzyme activities and accumulated less H2O2 than wild-type plants under Cd and Zn treatment. Thus, SaMT2 could significantly enhance Cd and Zn tolerance and accumulation in transgenic tobacco plants by chelating metals and improving antioxidant system.\n']",tobacco,http://europepmc.org/articles/PMC4102533?pdf=render,PLoS ONE,Public Library of Science (PLoS),Public Library of Science (PLoS),Medicine,True,True,True,True,Peer review,"['PDF', 'HTML', 'XML']",['EN'],True
10.1371/journal.pone.0088784,1932-6203,The Association of Tobacco Control Policies and the Risk of Acute Myocardial Infarction Using Hospital Admissions Data,Research Article,"['Carmen Jan', 'Marcos Lee', 'Reina Roa', 'Víctor Herrera', 'Michael Politis', 'Jorge Motta']",PLoS ONE,2014-02-10T00:00:00Z,5.635475,"['Objective: To evaluate the association of a nationwide comprehensive smoking ban (CSB) and tobacco tax increase (TTI) on the risk of acute myocardial infarctions (AMI) in Panama for the period of 2006 – 2010 using hospital admissions data. Methods: Data of AMI cases was gathered from public and private hospitals in the country for the period of January 1, 2006 to December 31, 2010. The number of AMI cases was calculated on a monthly basis. The risk of AMI was estimated for the pre-CSB period (January 2006 to April 2008) and was used as a reference point. Three post-intervention periods were examined: (1) post-CSB from May 2008 to April 2009 (12 months); (2) post-CSB from May 2009 to November 2009 (7 months); and (3) post-TTI from December 2009 to December 2010 (13 months). Relative risks (RR) of AMI were estimated for each post intervention periods by using a Poisson regression model. Mortality registries for the country attributed to myocardial infarction (MI) were obtained from January 2001 to December 2012. The annual percentage change (APC) of the number of deaths from MI was calculated using Joinpoint regression analysis. Results: A total sample size of 2191 AMI cases was selected (monthly mean number of cases 36.52±8.24 SD). Using the pre-CSB as a reference point (RR\u200a=\u200a1.00), the relative risk of AMI during the first CSB period, the second CSB period and post-TTI were 0.982, 1.049, and 0.985, respectively. The APC of deaths from MI from January 2001 to April 2008 was 0.5%. From January 2001 to June 2010 the APC trend was 0.47% and from July 2010 to December 2012 the APC was –0.3%. Conclusions: The implementation of a CSB and TTI in Panama were associated with a decrease in tobacco consumption and a reduction of the RR of AMI. ']",tobacco,http://europepmc.org/articles/PMC3919809?pdf=render,PLoS ONE,Public Library of Science (PLoS),Public Library of Science (PLoS),Medicine,True,True,True,True,Peer review,"['PDF', 'HTML', 'XML']",['EN'],True
10.1371/journal.pone.0019474,1932-6203,The Expression of a Xylanase Targeted to ER-Protein Bodies Provides a Simple Strategy to Produce Active Insoluble Enzyme Polymers in Tobacco Plants,Research Article,"['Immaculada Llop-Tous', 'Miriam Ortiz', 'Margarita Torrent', 'M. Dolors Ludevid']",PLoS ONE,2011-04-29T00:00:00Z,5.635475,"['Background: Xylanases deserve particular attention due to their potential application in the feed, pulp bleaching and paper industries. We have developed here an efficient system for the production of an active xylanase in tobacco plants fused to a proline-rich domain (Zera) of the maize storage protein γ-zein. Zera is a self-assembling domain able to form protein aggregates in vivo packed in newly formed endoplasmic reticulum-derived organelles known as protein bodies (PBs). Methodology/Principal Findings: Tobacco leaves were transiently transformed with a binary vector containing the Zera-xylanase coding region, which was optimized for plant expression, under the control of the 35S CaMV promoter. The fusion protein was efficiently expressed and stored in dense PBs, resulting in yields of up to 9% of total protein. Zera-xylanase was post-translationally modified with high-mannose-type glycans. Xylanase fused to Zera was biologically active not only when solubilized from PBs but also in its insoluble form. The resistance of insoluble Zera-xylanase to trypsin digestion demonstrated that the correct folding of xylanase in PBs was not impaired by Zera oligomerization. The activity of insoluble Zera-xylanase was enhanced when substrate accessibility was facilitated by physical treatments such as ultrasound. Moreover, we found that the thermostability of the enzyme was improved when Zera was fused to the C-terminus of xylanase. Conclusion/Significance: In the present work we have successfully produced an active insoluble aggregate of xylanase fused to Zera in plants. Zera-xylanase chimeric protein accumulates within ER-derived protein bodies as active aggregates that can easily be recovered by a simple density-based downstream process. The production of insoluble active Zera-xylanase protein in tobacco outlines the potential of Zera as a fusion partner for producing enzymes of biotechnological relevance. Zera-PBs could thus become efficient and low-cost bioreactors for industrial purposes. ']",tobacco,http://europepmc.org/articles/PMC3084875?pdf=render,PLoS ONE,Public Library of Science (PLoS),Public Library of Science (PLoS),Medicine,True,True,True,True,Peer review,"['PDF', 'HTML', 'XML']",['EN'],True
10.1371/journal.pone.0115900,1932-6203,"Factors Associated with Tobacco Smoking and Cessation among HIV-Infected Individuals under Care in Rio de Janeiro, Brazil",Research Article,"['Thiago S. Torres', 'Paula M. Luz', 'Monica Derrico', 'Luciane Velasque', 'Eduarda Grinsztejn', 'Valdiléa G. Veloso', 'Sandra W. Cardoso', 'Marília Santini-Oliveira', 'Beatriz Grinsztejn', 'Raquel Brandini De Boni']",PLoS ONE,2014-12-23T00:00:00Z,5.635475,"['\nWorldwide the prevalence of smoking among people living with HIV/AIDS is elevated compared to the general population. This probably reflects the cluster of individual characteristics that have shared risk factors for HIV infection and smoking. A cross-sectional study, enrolling a convenience sample from a Brazilian HIV clinical cohort was conducted to evaluate the prevalence of tobacco smoking and the factors associated with current smoking and abstinence. A total of 2,775 HIV-infected individuals were interviewed: 46.2% have never smoked, 29.9% were current smokers and 23.9% were former smokers. Current smokers had a higher prevalence of alcohol and illicit drug use when compared to the other two groups. A higher proportion of heterosexual individuals were former smokers or never smokers while among men who have sex with men (MSM) a higher proportion were current smokers. Former smokers had been more frequently diagnosed with high blood pressure, diabetes mellitus, cardiovascular diseases and depression, while for current smokers lung diseases were more frequent. Former smokers and current smokers were more likely to have had any hospital admission (42.0% and 41.2%, respectively) than participants who never smoked (33.5%) (p<0.001). Multivariate model results showed that current smokers (versus never smokers) were more likely to be less educated, to report the use of alcohol, crack and cocaine and to present clinical comorbidities. Former smokers (versus current smokers) were more likely to be older, to have smoked for a shorter amount of time and to have smoked >31 cigarettes/day. MSM (compared to heterosexuals) and cocaine users (versus non-users) had lower odds of being former smokers. Considering our results, smoking cessation interventions should be tailored to younger individuals, MSM and substance users.\n']",tobacco,http://europepmc.org/articles/PMC4275249?pdf=render,PLoS ONE,Public Library of Science (PLoS),Public Library of Science (PLoS),Medicine,True,True,True,True,Peer review,"['PDF', 'HTML', 'XML']",['EN'],True
10.1371/journal.pone.0115906,1932-6203,Changes in Cell Wall Properties Coincide with Overexpression of Extensin Fusion Proteins in Suspension Cultured Tobacco Cells,Research Article,"['Li Tan', 'Yunqiao Pu', 'Sivakumar Pattathil', 'Utku Avci', 'Jin Qian', 'Allison Arter', 'Liwei Chen', 'Michael G. Hahn', 'Arthur J. Ragauskas', 'Marcia J. Kieliszewski']",PLoS ONE,2014-12-23T00:00:00Z,5.635475,"['\nExtensins are one subfamily of the cell wall hydroxyproline-rich glycoproteins, containing characteristic SerHyp4 glycosylation motifs and intermolecular cross-linking motifs such as the TyrXaaTyr sequence. Extensins are believed to form a cross-linked network in the plant cell wall through the tyrosine-derivatives isodityrosine, pulcherosine, and di-isodityrosine. Overexpression of three synthetic genes encoding different elastin-arabinogalactan protein-extensin hybrids in tobacco suspension cultured cells yielded novel cross-linking glycoproteins that shared features of the extensins, arabinogalactan proteins and elastin. The cell wall properties of the three transgenic cell lines were all changed, but in different ways. One transgenic cell line showed decreased cellulose crystallinity and increased wall xyloglucan content; the second transgenic cell line contained dramatically increased hydration capacity and notably increased cell wall biomass, increased di-isodityrosine, and increased protein content; the third transgenic cell line displayed wall phenotypes similar to wild type cells, except changed xyloglucan epitope extractability. These data indicate that overexpression of modified extensins may be a route to engineer plants for bioenergy and biomaterial production.\n']",tobacco,http://europepmc.org/articles/PMC4275275?pdf=render,PLoS ONE,Public Library of Science (PLoS),Public Library of Science (PLoS),Medicine,True,True,True,True,Peer review,"['PDF', 'HTML', 'XML']",['EN'],True
10.1371/journal.pone.0129589,1932-6203,"<i>TaPP2C1</i>, a Group F2 Protein Phosphatase 2C Gene, Confers Resistance to Salt Stress in Transgenic Tobacco",Research Article,"['Wei Hu', 'Yan Yan', 'Xiaowan Hou', 'Yanzhen He', 'Yunxie Wei', 'Guangxiao Yang', 'Guangyuan He', 'Ming Peng']",PLoS ONE,2015-06-09T00:00:00Z,5.635475,"['\nGroup A protein phosphatases 2Cs (PP2Cs) are essential components of abscisic acid (ABA) signaling in Arabidopsis; however, the function of group F2 subfamily PP2Cs is currently less known. In this study, TaPP2C1 which belongs to group F2 was isolated and characterized from wheat. Expression of the TaPP2C1-GFP fusion protein suggested its ubiquitous localization within a cell. TaPP2C1 expression was downregulated by abscisic acid (ABA) and NaCl treatments, but upregulated by H2O2 treatment. Overexpression of TaPP2C1 in tobacco resulted in reduced ABA sensitivity and increased salt resistance of transgenic seedlings. Additionally, physiological analyses showed that improved resistance to salt stress conferred by TaPP2C1 is due to the reduced reactive oxygen species (ROS) accumulation, the improved antioxidant system, and the increased transcription of genes in the ABA-independent pathway. Finally, transgenic tobacco showed increased resistance to oxidative stress by maintaining a more effective antioxidant system. Taken together, these results demonstrated that TaPP2C1 negatively regulates ABA signaling, but positively regulates salt resistance. TaPP2C1 confers salt resistance through activating the antioxidant system and ABA-independent gene transcription process.\n']",tobacco,http://europepmc.org/articles/PMC4461296?pdf=render,PLoS ONE,Public Library of Science (PLoS),Public Library of Science (PLoS),Medicine,True,True,True,True,Peer review,"['PDF', 'HTML', 'XML']",['EN'],True
10.1371/journal.pone.0104620,1932-6203,Assessment of Cultivation Factors that Affect Biomass and Geraniol Production in Transgenic Tobacco Cell Suspension Cultures,Research Article,"['Nikolay Vasilev', 'Christian Schmitz', 'Ulrike Grömping', 'Rainer Fischer', 'Stefan Schillberg']",PLoS ONE,2014-08-12T00:00:00Z,5.635475,"['\nA large-scale statistical experimental design was used to determine essential cultivation parameters that affect biomass accumulation and geraniol production in transgenic tobacco (Nicotiana tabacum cv. Samsun NN) cell suspension cultures. The carbohydrate source played a major role in determining the geraniol yield and factors such as filling volume, inoculum size and light were less important. Sucrose, filling volume and inoculum size had a positive effect on geraniol yield by boosting growth of plant cell cultures whereas illumination of the cultures stimulated the geraniol biosynthesis. We also found that the carbohydrates sucrose and mannitol showed polarizing effects on biomass and geraniol accumulation. Factors such as shaking frequency, the presence of conditioned medium and solubilizers had minor influence on both plant cell growth and geraniol content. When cells were cultivated under the screened conditions for all the investigated factors, the cultures produced ∼5.2 mg/l geraniol after 12 days of cultivation in shaking flasks which is comparable to the yield obtained in microbial expression systems. Our data suggest that industrial experimental designs based on orthogonal arrays are suitable for the selection of initial cultivation parameters prior to the essential medium optimization steps. Such designs are particularly beneficial in the early optimization steps when many factors must be screened, increasing the statistical power of the experiments without increasing the demand on time and resources.\n']",tobacco,http://europepmc.org/articles/PMC4130582?pdf=render,PLoS ONE,Public Library of Science (PLoS),Public Library of Science (PLoS),Medicine,True,True,True,True,Peer review,"['PDF', 'HTML', 'XML']",['EN'],True
10.1371/journal.pone.0137740,1932-6203,Changes in Tobacco Smoke Exposure following the Institution of a Smoke-Free Policy in the Boston Housing Authority,Research Article,"['Douglas E. Levy', 'Gary Adamkiewicz', 'Nancy A. Rigotti', 'Shona C. Fang', 'Jonathan P. Winickoff']",PLoS ONE,2015-09-11T00:00:00Z,5.635475,"['Introduction: To protect residents from tobacco smoke exposure (TSE), the Boston Housing Authority (BHA) prohibited smoking in BHA-owned apartments beginning in 2012. Our goal was to determine if the smoke-free policy reduced TSE for non-smoking BHA residents. Methods: We compared TSE before the smoke-free policy (2012) and one year later among BHA residents as well as residents of the neighboring Cambridge Housing Authority (CHA) where no such policy was in place. Participants were a convenience sample of adult non-smoking BHA and CHA residents cohabitating with only non-smokers. Main outcomes were 7-day airborne nicotine in participants’ apartments; residents’ saliva cotinine; and residents’ self-reported TSE. Results: We enrolled 287 confirmed non-smokers (192 BHA, 95 CHA). Seventy-nine percent (229) were assessed at follow-up. At baseline, apartment and resident TSE were high in both housing authorities (detectable airborne nicotine: 46% BHA, 48% CHA; detectable saliva cotinine: 49% BHA, 70% CHA). At follow-up there were significant but similar declines in nicotine in both sites (detectable: -33% BHA, -39% CHA, p = 0.40). Detectable cotinine rose among BHA residents while declining among CHA participants (+17% BHA vs. -13% CHA, p = 0.002). Resident self-reported TSE within and outside of the housing environment decreased similarly for both BHA and CHA residents. Conclusions: Apartment air nicotine decreased after the introduction of the smoke-free policy, though the decline may not have resulted from the policy. The BHA policy did not result in reduced individual-level TSE. Unmeasured sources of non-residential TSE may have contributed to BHA residents’ cotinine levels. ']",tobacco,http://europepmc.org/articles/PMC4567081?pdf=render,PLoS ONE,Public Library of Science (PLoS),Public Library of Science (PLoS),Medicine,True,True,True,True,Peer review,"['PDF', 'HTML', 'XML']",['EN'],True
10.1371/journal.pone.0027120,1932-6203,Comparative Transcriptional Analysis Reveals Differential Gene Expression between Asymmetric and Symmetric Zygotic Divisions in Tobacco,Research Article,"['Tian-Xiang Hu', 'Miao Yu', 'Jie Zhao']",PLoS ONE,2011-11-01T00:00:00Z,5.635475,"['\n        Asymmetric cell divisions occur widely during many developmental processes in plants. In most angiosperms, the first zygotic cell division is asymmetric resulting in two daughter cells of unequal size and with distinct fates. However, the critical molecular mechanisms regulating this division remain unknown. Previously we showed that treatment of tobacco zygotes with beta-glucosyl Yariv (βGlcY) could dramatically alter the first zygotic asymmetric division to produce symmetric two-celled proembryos. In the present study, we isolated zygotes and two-celled asymmetric proembryos in vivo by micromanipulation, and obtained symmetric, two-celled proembryos by in vitro cell cultures. Using suppression-subtractive hybridization (SSH) and macroarray analysis differential gene expression between the zygote and the asymmetric and symmetric two-celled proembryos was investigated. After sequencing of the differentially expressed clones, a total of 1610 EST clones representing 685 non-redundant transcripts were obtained. Gene ontology (GO) term analysis revealed that these transcripts include those involved in physiological processes such as response to stimulus, regulation of gene expression, and localization and formation of anatomical structures. A homology search against known genes from Arabidopsis indicated that some of the above transcripts are involved in asymmetric cell division and embryogenesis. Quantitative real-time PCR confirmed the up- or down-regulation of the selected candidate transcripts during zygotic division. A few of these transcripts were expressed exclusively in the zygote, or in either type of the two-celled proembryos. Expression analyses of select genes in different tissues and organs also revealed potential roles of these transcripts in fertilization, seed maturation and organ development. The putative roles of few of the identified transcripts in the regulation of zygotic division are discussed. Further functional work on these candidate transcripts will provide important information for understanding asymmetric zygotic division, generation of apical-basal polarity and cell fate decisions during early embryogenesis.\n      ']",tobacco,http://europepmc.org/articles/PMC3206072?pdf=render,PLoS ONE,Public Library of Science (PLoS),Public Library of Science (PLoS),Medicine,True,True,True,True,Peer review,"['PDF', 'HTML', 'XML']",['EN'],True
10.1371/journal.pone.0041722,1932-6203,Investigating the Production of Foreign Membrane Proteins in Tobacco Chloroplasts: Expression of an Algal Plastid Terminal Oxidase,Research Article,"['Niaz Ahmad', 'Franck Michoux', 'Peter J. Nixon']",PLoS ONE,2012-07-25T00:00:00Z,5.635475,"['\n        Chloroplast transformation provides an inexpensive, easily scalable production platform for expression of recombinant proteins in plants. However, this technology has been largely limited to the production of soluble proteins. Here we have tested the ability of tobacco chloroplasts to express a membrane protein, namely plastid terminal oxidase 1 from the green alga Chlamydomonas reinhardtii (Cr-PTOX1), which is predicted to function as a plastoquinol oxidase. A homoplastomic plant containing a codon-optimised version of the nuclear gene encoding PTOX1, driven by the 16S rRNA promoter and 5′UTR of gene 10 from phage T7, was generated using a particle delivery system. Accumulation of Cr-PTOX1 was shown by immunoblotting and expression in an enzymatically active form was confirmed by using chlorophyll fluorescence to measure changes in the redox state of the plastoquinone pool in leaves. Growth of Cr-PTOX1 expressing plants was, however, more sensitive to high light than WT. Overall our results confirm the feasibility of using plastid transformation as a means of expressing foreign membrane proteins in the chloroplast.\n      ']",tobacco,http://europepmc.org/articles/PMC3404998?pdf=render,PLoS ONE,Public Library of Science (PLoS),Public Library of Science (PLoS),Medicine,True,True,True,True,Peer review,"['PDF', 'HTML', 'XML']",['EN'],True
10.1371/journal.pone.0111379,1932-6203,The <i>SbMT-2</i> Gene from a Halophyte Confers Abiotic Stress Tolerance and Modulates ROS Scavenging in Transgenic Tobacco,Research Article,"['Amit Kumar Chaturvedi', 'Manish Kumar Patel', 'Avinash Mishra', 'Vivekanand Tiwari', 'Bhavanath Jha']",PLoS ONE,2014-10-23T00:00:00Z,5.635475,"['\nHeavy metals are common pollutants of the coastal saline area and Salicornia brachiata an extreme halophyte is frequently exposed to various abiotic stresses including heavy metals. The SbMT-2 gene was cloned and transformed to tobacco for the functional validation. Transgenic tobacco lines (L2, L4, L6 and L13) showed significantly enhanced salt (NaCl), osmotic (PEG) and metals (Zn++, Cu++ and Cd++) tolerance compared to WT plants. Transgenic lines did not show any morphological variation and had enhanced growth parameters viz. shoot length, root length, fresh weight and dry weight. High seed germination percentage, chlorophyll content, relative water content, electrolytic leakage and membrane stability index confirmed that transgenic lines performed better under salt (NaCl), osmotic (PEG) and metals (Zn++, Cu++ and Cd++) stress conditions compared to WT plants. Proline, H2O2 and lipid peroxidation (MDA) analyses suggested the role of SbMT-2 in cellular homeostasis and H2O2 detoxification. Furthermore in vivo localization of H2O2 and O2−; and elevated expression of key antioxidant enzyme encoding genes, SOD, POD and APX evident the possible role of SbMT-2 in ROS scavenging/detoxification mechanism. Transgenic lines showed accumulation of Cu++ and Cd++ in root while Zn++ in stem under stress condition. Under control (unstressed) condition, Zn++ was accumulated more in root but accumulation of Zn++ in stem under stress condition suggested that SbMT-2 may involve in the selective translocation of Zn++ from root to stem. This observation was further supported by the up-regulation of zinc transporter encoding genes NtZIP1 and NtHMA-A under metal ion stress condition. The study suggested that SbMT-2 modulates ROS scavenging and is a potential candidate to be used for phytoremediation and imparting stress tolerance.\n']",tobacco,http://europepmc.org/articles/PMC4207811?pdf=render,PLoS ONE,Public Library of Science (PLoS),Public Library of Science (PLoS),Medicine,True,True,True,True,Peer review,"['PDF', 'HTML', 'XML']",['EN'],True
