id,eissn,title_display,article_type,author_display,journal,publication_date,score,abstract,keyword,bibjson.link,title,provider,publisher,subject,active,article_statistics.statistics,author_copyright.copyright,author_publishing_rights.publishing_rights,editorial_review.process,format,language,plagiarism_detection.detection
10.1371/journal.pone.0025347,1932-6203,Areca Users in Combination with Tobacco and Alcohol Use Are Associated with Younger Age of Diagnosed Esophageal Cancer in Taiwanese Men,Research Article,"['Ming-Yen Lin', 'Mei-Chin Chen', 'I-Chen Wu', 'Deng-Chyang Wu', 'Yu-Jen Cheng', 'Chun-Chieh Wu', 'Chee-Yin Chai', 'Jang-Ming Lee', 'Ming-Tsang Wu']",PLoS ONE,2011-10-19T00:00:00Z,5.635475,"['Background: Whether the habitual use of substances (tobacco, alcohol, or areca nut (seed of the Areca palm)) can affect the age of esophageal squamous cell carcinoma (ESCC) presentation has rarely been examined. Methods: The study subjects were those who were males and the first time to be diagnosed as ESCC (ICD-9 150) and who visited any of three medical centers in Taiwan between 2000 and 2009. A standardized questionnaire was used to collect substance uses and other variables. Results: Mean age (±SD) at presentation of ESCC was 59.2 (±11.3) years in a total of 668 cases. After adjusting for other covariates, alcohol drinkers were 3.58 years younger to have ESCC than non-drinkers (p\u200a=\u200a0.002). A similar result was found among areca chewers, who were 6.34 years younger to have ESCC than non-chewers (p<0.0001), but not among cigarette smokers (p\u200a=\u200a0.10). When compared to the group using 0–1 substances, subjects using both cigarettes and alcohol were nearly 3 years younger to contract ESCC. Furthermore, those who use areca plus another substance were 7–8 years younger. Subjects using all three substances had the greatest age difference, 9.20 years younger (p<0.0001), compared to the comparison group. Conclusion: Our findings suggest that habitually consuming tobacco, alcohol, and areca nut can influence the age-onset of ESCC. Since the development of ESCC is insidious and life-threatening, our observation is worthy to be reconfirmed in the large-scale and long-term follow-up prospective cohort studies to recommend the screening strategy of this disease. ']",tobacco,http://europepmc.org/articles/PMC3198438?pdf=render,PLoS ONE,Public Library of Science (PLoS),Public Library of Science (PLoS),Medicine,True,True,True,True,Peer review,"['PDF', 'HTML', 'XML']",['EN'],True
10.1371/journal.pone.0100792,1932-6203,Transgenic Tobacco Plants Overexpressing a Grass <i>PpEXP1</i> Gene Exhibit Enhanced Tolerance to Heat Stress,Research Article,"['Qian Xu', 'Xiao Xu', 'Yang Shi', 'Jichen Xu', 'Bingru Huang']",PLoS ONE,2014-07-08T00:00:00Z,5.635475,"['\nHeat stress is a detrimental abiotic stress limiting the growth of many plant species and is associated with various cellular and physiological damages. Expansins are a family of proteins which are known to play roles in regulating cell wall elongation and expansion, as well as other growth and developmental processes. The in vitro roles of expansins regulating plant heat tolerance are not well understood. The objectives of this study were to isolate and clone an expansin gene in a perennial grass species (Poa pratensis) and to determine whether over-expression of expansin may improve plant heat tolerance. Tobacco (Nicotiana tabacum) was used as the model plant for gene transformation and an expansin gene PpEXP1 from Poa pratensis was cloned. Sequence analysis showed PpEXP1 belonged to α-expansins and was closely related to two expansin genes in other perennial grass species (Festuca pratensis and Agrostis stolonifera) as well as Triticum aestivum, Oryza sativa, and Brachypodium distachyon. Transgenic tobacco plants over-expressing PpEXP1 were generated through Agrobacterium-mediated transformation. Under heat stress (42°C) in growth chambers, transgenic tobacco plants over-expressing the PpEXP1 gene exhibited a less structural damage to cells, lower electrolyte leakage, lower levels of membrane lipid peroxidation, and lower content of hydrogen peroxide, as well as higher chlorophyll content, net photosynthetic rate, relative water content, activity of antioxidant enzyme, and seed germination rates, compared to the wild-type plants. These results demonstrated the positive roles of PpEXP1 in enhancing plant tolerance to heat stress and the possibility of using expansins for genetic modification of cool-season perennial grasses in the development of heat-tolerant germplasm and cultivars.\n']",tobacco,http://europepmc.org/articles/PMC4086929?pdf=render,PLoS ONE,Public Library of Science (PLoS),Public Library of Science (PLoS),Medicine,True,True,True,True,Peer review,"['PDF', 'HTML', 'XML']",['EN'],True
10.1371/journal.pone.0029302,1932-6203,Expression of <i>Trichoderma reesei</i> β-Mannanase in Tobacco Chloroplasts and Its Utilization in Lignocellulosic Woody Biomass Hydrolysis,Research Article,"['Pankaj Agrawal', 'Dheeraj Verma', 'Henry Daniell']",PLoS ONE,2011-12-28T00:00:00Z,5.635475,"['\n        Lignocellulosic ethanol offers a promising alternative to conventional fossil fuels. One among the major limitations in the lignocellulosic biomass hydrolysis is unavailability of efficient and environmentally biomass degrading technologies. Plant-based production of these enzymes on large scale offers a cost-effective solution. Cellulases, hemicellulases including mannanases and other accessory enzymes are required for conversion of lignocellulosic biomass into fermentable sugars. β-mannanase catalyzes endo-hydrolysis of the mannan backbone, a major constituent of woody biomass. In this study, the man1 gene encoding β-mannanase was isolated from Trichoderma reesei and expressed via the chloroplast genome. PCR and Southern hybridization analysis confirmed site-specific transgene integration into the tobacco chloroplast genomes and homoplasmy. Transplastomic plants were fertile and set viable seeds. Germination of seeds in the selection medium showed inheritance of transgenes into the progeny without any Mendelian segregation. Expression of endo-β-mannanase for the first time in plants facilitated its characterization for use in enhanced lignocellulosic biomass hydrolysis. Gel diffusion assay for endo-β-mannanase showed the zone of clearance confirming functionality of chloroplast-derived mannanase. Endo-β-mannanase expression levels reached up to 25 units per gram of leaf (fresh weight). Chloroplast-derived mannanase had higher temperature stability (40°C to 70°C) and wider pH optima (pH 3.0 to 7.0) than E.coli enzyme extracts. Plant crude extracts showed 6–7 fold higher enzyme activity than E.coli extracts due to the formation of disulfide bonds in chloroplasts, thereby facilitating their direct utilization in enzyme cocktails without any purification. Chloroplast-derived mannanase when added to the enzyme cocktail containing a combination of different plant-derived enzymes yielded 20% more glucose equivalents from pinewood than the cocktail without mannanase. Our results demonstrate that chloroplast-derived mannanase is an important component of enzymatic cocktail for woody biomass hydrolysis and should provide a cost-effective solution for its diverse applications in the biofuel, paper, oil, pharmaceutical, coffee and detergent industries.\n      ']",tobacco,http://europepmc.org/articles/PMC3247253?pdf=render,PLoS ONE,Public Library of Science (PLoS),Public Library of Science (PLoS),Medicine,True,True,True,True,Peer review,"['PDF', 'HTML', 'XML']",['EN'],True
10.1371/journal.pone.0188188,1932-6203,Tobacco industry attempts to frame smoking as a 'disability' under the 1990 Americans with Disabilities Act,Research Article,"['Yvette van der Eijk', 'Stanton A. Glantz']",PLoS ONE,2017-11-27T00:00:00Z,5.635475,"['\nUsing the Truth Tobacco Industry Documents Library and Congressional records, we examined the tobacco industry’s involvement with the 1990 Americans with Disabilities Act (ADA). During legislative drafting of the ADA (1989–1990), the Tobacco Institute, the tobacco industry’s lobbying and public relations arm at the time, worked with industry lawyers and civil rights groups to include smoking in the ADA’s definition of “disability.” Focus was on smoking as a perceived rather than actual disability so that tobacco companies could maintain that smoking is not addictive. Language that would have explicitly excluded smoking from ADA coverage was weakened or omitted. Tobacco Institute lawyers did not think the argument that smokers are “disabled” would convince the courts, so in the two years after the ADA was signed into law, the Tobacco Institute paid a lawyer to conduct media tours, seminars, and write articles to convince employers that hiring only non-smokers would violate the ADA. The ultimate goal of these activities was to deter employers from promoting a healthy, tobacco-free workforce and, more broadly, to promote the social acceptability of smoking. Employers and policy makers need to be aware that tobacco use is not protected by the ADA and should not be misled by tobacco industry efforts to insinuate otherwise.\n']",tobacco,http://europepmc.org/articles/PMC5703483?pdf=render,PLoS ONE,Public Library of Science (PLoS),Public Library of Science (PLoS),Medicine,True,True,True,True,Peer review,"['PDF', 'HTML', 'XML']",['EN'],True
10.1371/journal.pone.0066317,1932-6203,EffiCiency and Safety of an eLectronic cigAreTte (ECLAT) as Tobacco Cigarettes Substitute: A Prospective 12-Month Randomized Control Design Study,Research Article,"['Pasquale Caponnetto', 'Davide Campagna', 'Fabio Cibella', 'Jaymin B. Morjaria', 'Massimo Caruso', 'Cristina Russo', 'Riccardo Polosa']",PLoS ONE,2013-06-24T00:00:00Z,5.635475,"['Background: Electronic cigarettes (e-cigarettes) are becoming increasingly popular with smokers worldwide. Users report buying them to help quit smoking, to reduce cigarette consumption, to relieve tobacco withdrawal symptoms, and to continue having a ‘smoking’ experience, but with reduced health risks. Research on e-cigarettes is urgently needed in order to ensure that the decisions of regulators, healthcare providers and consumers are based on science. Results: Declines in cig/day use and eCO levels were observed at each study visits in all three study groups (p<0.001 vs baseline), with no consistent differences among study groups. Smoking reduction was documented in 22.3% and 10.3% at week-12 and week-52 respectively. Complete abstinence from tobacco smoking was documented in 10.7% and 8.7% at week-12 and week-52 respectively. A substantial decrease in adverse events from baseline was observed and withdrawal symptoms were infrequently reported during the study. Participants’ perception and acceptance of the product under investigation was satisfactory. Conclusion: In smokers not intending to quit, the use of e-cigarettes, with or without nicotine, decreased cigarette consumption and elicited enduring tobacco abstinence without causing significant side effects. Trial Registration: ClinicalTrials.gov NCT01164072 NCT01164072 ']",tobacco,http://europepmc.org/articles/PMC3691171?pdf=render,PLoS ONE,Public Library of Science (PLoS),Public Library of Science (PLoS),Medicine,True,True,True,True,Peer review,"['PDF', 'HTML', 'XML']",['EN'],True
10.1371/journal.pone.0150710,1932-6203,Effect of Workplace Counseling Interventions Launched by Workplace Health Promotion and Tobacco Control Centers in Taiwan: An Evaluation Based on the Ottawa Charter,Research Article,"['Tzu-Hua Chen', 'Joh-Jong Huang', 'Fong-Ching Chang', 'Yu-Tsz Chang', 'Hung-Yi Chuang']",PLoS ONE,2016-03-08T00:00:00Z,5.635475,"['\nWorkplace health promotion (WHP) is important to prevent work-related diseases, reduce workplace hazards, and improve personal health of the workers. Health promotion projects were launched through the centers of WHP funded by the Taiwan Bureau of Health Promotion since 2003. Hence, the aim of this study is to evaluate the impact of WHP programs intervention from 2003 to 2007. The intervention group consisted of 838 business entities which had ever undergone counseling of the three centers in northern, central, and southern Taiwan from 2003 to 2007. The control group was composed of 1000 business entities randomly selected from the business directories of the Ministry of Economic Affairs, Taiwan. The questionnaire survey included general company profiles and the assessment of workplace health according to the five action areas of the Ottawa Charter for Health Promotion. We have received 447 (53.3%) questionnaires from the intervention group and 97 questionnaires from the control group. The intervention group was more effective in using the external resources and medical consultation, and they had better follow-up rates of the abnormal results of annual health examinations. Compared to the control group, the intervention group had a significantly decreased smoking rate in 246 companies (61.2%) and a reduced second-hand smoke exposure in 323 companies (78.6%) (p<0.001). By means of the intervention of WHP programs, we can enhance the awareness of the enterprises and the employees to improve worksite health and to create a healthy work environment.\n']",tobacco,http://europepmc.org/articles/PMC4783054?pdf=render,PLoS ONE,Public Library of Science (PLoS),Public Library of Science (PLoS),Medicine,True,True,True,True,Peer review,"['PDF', 'HTML', 'XML']",['EN'],True
10.1371/journal.pone.0161147,1932-6203,Systematic Isolation and Characterization of Cadmium Tolerant Genes in Tobacco: A cDNA Library Construction and Screening Approach,Research Article,"['Mei Zhang', 'Hui Mo', 'Wen Sun', 'Yan Guo', 'Jing Li']",PLoS ONE,2016-08-31T00:00:00Z,5.635475,"['\nHeavy metal pollution is a major limiting factor that severely affects plant growth worldwide, and the accumulation of heavy metal in the plant may be hazardous to human health. To identify the processes involved in cadmium detoxification, we constructed a cDNA library of tobacco roots acclimated to cadmium (Cd) stress. According to the results of functional screening cDNA library with a yeast Cd-sensitive mutant, ycf1Δ, we obtained a series of candidate genes that were involved in Cd response. Sequence analysis and yeast functional complementation of 24 positive cDNA clones revealed that, in addition to antioxidant genes, genes implicated in abiotic and biotic stress defenses, cellular metabolism, and signal transduction showed Cd detoxification effects in yeast. The real time RT-PCR analyses revealed that some Cd tolerance/ detoxification genes may be able to anticipate in other stresses such as biotic defense and water balance in tobacco. Taken together, our data suggest that plants’ acclimation to Cd stress is a highly complex process associated with broad gene functions. Moreover, our results provide insights into the Cd detoxification mechanisms along with the antioxidant system, defense gene induction, and calcium signal pathway.\n']",tobacco,http://europepmc.org/articles/PMC5007098?pdf=render,PLoS ONE,Public Library of Science (PLoS),Public Library of Science (PLoS),Medicine,True,True,True,True,Peer review,"['PDF', 'HTML', 'XML']",['EN'],True
10.1371/journal.pone.0057274,1932-6203,The Novel Approach to Enhance Seed Security: Dual Anti-Counterfeiting Methods Applied on Tobacco Pelleted Seeds,Research Article,"['Yajing Guan', 'Jianchen Wang', 'Yixin Tian', 'Weimin Hu', 'Liwei Zhu', 'Shuijin Zhu', 'Jin Hu']",PLoS ONE,2013-02-28T00:00:00Z,5.635475,"['\n        Seed security is of prime importance for agriculture. To protect true seeds from being faked, more secure dual anti-counterfeiting technologies for tobacco (Nicotiana tabacum L.) pelleted seed were developed in this paper. Fluorescein (FR), rhodamine B (RB), and magnetic powder (MP) were used as anti-counterfeiting labels. According to their different properties and the special seed pelleting process, four dual-labeling treatments were conducted for two tobacco varieties, MS Yunyan85 (MSYY85) and Honghua Dajinyuan (HHDJY). Then the seed germination and seedling growth status were investigated, and the fluorescence in cracked pellets and developing seedlings was observed under different excitation lights. The results showed that FR, RB, and MP had no negative effects on the germination, seedling growth, and MDA content of the pelleted seeds, and even some treatments significantly enhanced seedling dry weight, vigor index, and shoot height in MS YY85, and increased SOD activity and chlorophyll content in HHDJY as compared to the control. In addition, the cotyledon tip of seedlings treated with FR and MP together represented bright green fluorescence under illumination of blue light (478 nm). And the seedling cotyledon vein treated with RB and MP together showed red fluorescence under green light (546 nm). All seeds pelleted with magnetic powder of proper concentration could be attracted by a magnet. Thus, it indicated that those new dual-labeling methods that fluorescent compound and magnetic powder simultaneously applied in the same seed pellets definitely improved anti-counterfeiting technology and enhanced the seed security. This technology will ensure that high quality seed will be used in the crop production.\n      ']",tobacco,http://europepmc.org/articles/PMC3585396?pdf=render,PLoS ONE,Public Library of Science (PLoS),Public Library of Science (PLoS),Medicine,True,True,True,True,Peer review,"['PDF', 'HTML', 'XML']",['EN'],True
10.1371/journal.pone.0032255,1932-6203,Single Molecule PCR Reveals Similar Patterns of Non-Homologous DSB Repair in Tobacco and <i>Arabidopsis</i>,Research Article,"['Andrew H. Lloyd', 'Dong Wang', 'Jeremy N. Timmis']",PLoS ONE,2012-02-28T00:00:00Z,5.635475,"['\n        DNA double strand breaks (DSBs) occur constantly in eukaryotes. These potentially lethal DNA lesions are repaired efficiently by two major DSB repair pathways: homologous recombination and non-homologous end joining (NHEJ). We investigated NHEJ in Arabidopsis thaliana and tobacco (Nicotiana tabacum) by introducing DNA double-strand breaks through inducible expression of I-SceI, followed by amplification of individual repair junction sequences by single-molecule PCR. Using this process over 300 NHEJ repair junctions were analysed in each species. In contrast to previously published variation in DSB repair between Arabidopsis and tobacco, the two species displayed similar DSB repair profiles in our experiments. The majority of repair events resulted in no loss of sequence and small (1–20 bp) deletions occurred at a minority (25–45%) of repair junctions. Approximately ∼1.5% of the observed repair events contained larger deletions (>20 bp) and a similar percentage contained insertions. Strikingly, insertion events in tobacco were associated with large genomic deletions at the site of the DSB that resulted in increased micro-homology at the sequence junctions suggesting the involvement of a non-classical NHEJ repair pathway. The generation of DSBs through inducible expression of I-SceI, in combination with single molecule PCR, provides an effective and efficient method for analysis of individual repair junctions and will prove a useful tool in the analysis of NHEJ.\n      ']",tobacco,http://europepmc.org/articles/PMC3289645?pdf=render,PLoS ONE,Public Library of Science (PLoS),Public Library of Science (PLoS),Medicine,True,True,True,True,Peer review,"['PDF', 'HTML', 'XML']",['EN'],True
10.1371/journal.pone.0077275,1932-6203,The <i>Scutellaria baicalensis</i> R2R3-MYB Transcription Factors Modulates Flavonoid Biosynthesis by Regulating GA Metabolism in Transgenic Tobacco Plants,Research Article,"['Yuan Yuan', 'Chong Wu', 'Yunjun Liu', 'Jian Yang', 'Luqi Huang']",PLoS ONE,2013-10-15T00:00:00Z,5.635475,"['\n\t\t\t\tR2R3-MYB proteins play role in plant development, response to biotic and abiotic stress, and regulation of primary and secondary metabolism. Little is known about the R2R3-MYB proteins in Scutellaria baicalensis which is an important Chinese medical plant. In this paper, nineteen putative SbMYB genes were identified from a S. baicalensis cDNA library, and eleven R2R3-MYBs were clustered into 5 subgroups according to phylogenetic reconstruction. In the S. baicalensis leaves which were sprayed with GA3, SbMYB2 and SbMYB7 had similar expression pattern with SbPALs, indicating that SbMYB2 and SbMYB7 might be involved in the flavonoid metabolism. Transactivation assay results showed that SbMYB2 and SbMYB7 can function as transcriptional activator. The expression of several flavonoid biosynthesis-related genes were induced or suppressed by overexpression of SbMYB2 or SbMYB7 in transgenic tobacco plants. Consistent with the change of the expression of NtDH29 and NtCHI, the contents of dicaffeoylspermidine and quercetin-3,7-O-diglucoside in SbMYB2-overexpressing or SbMYB7-overexpressing transgenic tobacco plants were decreased. The transcriptional level of NtUFGT in transgenic tobacco overexpressing SbMYB7 and the transcriptional level of NtHCT in SbMYB2-overexpressing tobacco plants were increased; however the application of GA3 inhibited the transcriptional level of these two genes. These results suggest that SbMYB2 and SbMYB7 might regulate the flavonoid biosynthesis through GA metabolism. \n\t\t\t']",tobacco,http://europepmc.org/articles/PMC3797077?pdf=render,PLoS ONE,Public Library of Science (PLoS),Public Library of Science (PLoS),Medicine,True,True,True,True,Peer review,"['PDF', 'HTML', 'XML']",['EN'],True
10.1371/journal.pone.0063257,1932-6203,Graft Transmission of RNA Silencing to Non-Transgenic Scions for Conferring Virus Resistance in Tobacco,Research Article,"['Emran Md. Ali', 'Kappei Kobayashi', 'Naoto Yamaoka', 'Masayuki Ishikawa', 'Masamichi Nishiguchi']",PLoS ONE,2013-05-22T00:00:00Z,5.635475,"['\nRNA silencing is a mechanism of gene regulation by sequence specific RNA degradation and is involved in controlling endogenous gene expression and defense against invasive nucleic acids such as viruses. RNA silencing has been proven to be transmitted between scions and rootstocks through grafting, mostly using transgenic plants. It has been reported that RNA silencing of tobacco endogenous genes, NtTOM1 and NtTOM3, that are required for tobamovirus multiplication, resulted in high resistance against several tobamoviruses. In the present study, we examined the graft transmission of RNA silencing for conferring virus resistance to non-transgenic scions of the same and different Nicotiana species grafted onto rootstocks in which both NtTOM1 and NtTOM3 were silenced. Non-transgenic Nicotiana tabacum (cvs. Samsun and Xanthi nc) and N. benthamiana were used as scions for grafting onto the rootstocks silenced with both genes. Short interfering RNA (siRNA) of NtTOM1 and NtTOM3 was detected in both the scions and the rootstocks eight weeks after grafting. The leaves were detached from the scions and inoculated with several tobamoviruses. The virus accumulation was tested by ELISA and northern blot analysis. The viruses were detected in grafted scions at extremely low levels, showing that virus resistance was conferred. These results suggest that RNA silencing was induced in and virus resistance was conferred to the non-transgenic scions by grafting onto silenced rootstocks. The effect of low temperature on siRNA accumulation and virus resistance was not significantly observed in the scions.\n']",tobacco,http://europepmc.org/articles/PMC3661558?pdf=render,PLoS ONE,Public Library of Science (PLoS),Public Library of Science (PLoS),Medicine,True,True,True,True,Peer review,"['PDF', 'HTML', 'XML']",['EN'],True
10.1371/journal.pone.0130556,1932-6203,"Identification, Characterization and Down-Regulation of <i>Cysteine Protease</i> Genes in Tobacco for Use in Recombinant Protein Production",Research Article,"['Kishor Duwadi', 'Ling Chen', 'Rima Menassa', 'Sangeeta Dhaubhadel']",PLoS ONE,2015-07-06T00:00:00Z,5.635475,"['\nPlants are an attractive host system for pharmaceutical protein production. Many therapeutic proteins have been produced and scaled up in plants at a low cost compared to the conventional microbial and animal-based systems. The main technical challenge during this process is to produce sufficient levels of recombinant proteins in plants. Low yield is generally caused by proteolytic degradation during expression and downstream processing of recombinant proteins. The yield of human therapeutic interleukin (IL)-10 produced in transgenic tobacco leaves was found to be below the critical level, and may be due to degradation by tobacco proteases. Here, we identified a total of 60 putative cysteine protease genes (CysP) in tobacco. Based on their predicted expression in leaf tissue, 10 candidate CysPs (CysP1-CysP10) were selected for further characterization. The effect of CysP gene silencing on IL-10 accumulation was examined in tobacco. It was found that the recombinant protein yield in tobacco could be increased by silencing CysP6. Transient expression of CysP6 silencing construct also showed an increase in IL-10 accumulation in comparison to the control. Moreover, CysP6 localizes to the endoplasmic reticulum (ER), suggesting that ER may be the site of IL-10 degradation. Overall results suggest that CysP6 is important in determining the yield of recombinant IL-10 in tobacco leaves.\n']",tobacco,http://europepmc.org/articles/PMC4493103?pdf=render,PLoS ONE,Public Library of Science (PLoS),Public Library of Science (PLoS),Medicine,True,True,True,True,Peer review,"['PDF', 'HTML', 'XML']",['EN'],True
